Timestamp,Message
14953,You don't have to fight him! Most people aren't ready to at this point. You can sneak around and grab the arrows. 
29235,Congrats on finishing the shrines! This list should help: http://www.ign.com/wikis/the-legend-of-zelda-breath-of-the-wild/Shrine_Quests
29387,http://www.ign.com/wikis/the-legend-of-zelda-breath-of-the-wild/Shrine_Quests
29428,http://www.ign.com/wikis/the-legend-of-zelda-breath-of-the-wild/Shrine_Quests
49024,"Yeah! Basically, after you talk to the NPC that starts the shrine quest, it'll say shrine quest completed. "
