Timestamp,Message
1040336,"I hated the goron challenge on the moon.  The only part I spent more time on was gyorg.  I was stuck on gyorg for months.  But then adult links older cousin, the fierce deity came to play and I kicked his ass."
1040566,Also the Dodongos in the northern area of Termina Field
1040684,The Darknut in Temple of Time was ~~different~~ stronger than the other ones.
1040842,"Wait a minute, do you have to finish every repeated boss twice in a row to get the shield?"
1041128,I liked the wolf at first but when the time came that [I could turn into it whenever I wanted](/spoiler) I just didn't like it
