Timestamp,Message
205848,"not really true, Iv played the game for 100+ hours.
I still hate that weapons break, sure there is one weapon that isn't as much of a problem with.
But everything else still feels flimsy.
Get through one camp of a hard mob and tell me that weapon hasn't broken or is 1 or 2 hits away from breaking.

Nice assumptions about his playtime. Knowitall/////"
206617,"wii u is actually faster on loading with eshop install.
Source: check speed runs. People run it on wii u for a reason."
207079,"This outrage is just 8.8 twilight princess all over again.
Good job internet."
