Timestamp,Message
28308,Those pyramids. 
28564,Those are the most accurate 2 points anyone could make. In OoT there were pyramid titties and you could barely notice them. Now we have wayyy better graphics and everyone loses their shit. What's also funny is that we all want a more adult version of a zelda game and people go crazy over a pair of tits. 
28619,You saw one pic. Relax buddy. 
28708,"In all seriousness, they're pretty nice for a Zelda game. Somewhat refreshing for the adult players. "
28847,Yeah don't let your mother see. 
28927,But haven't we asked for a more adult zelda game? A little cleave isn't bad. 
30848,Well thats who all the other zelda games are for. 
