Timestamp,Message
5884,"Minor spoiler warning just in case:

I saw light blue glowing light in the distance on a mountain and followed. Turned out to be some god of the mountain. Can I mount it? I assume I can, I spooked it off though. More importantly, how often does it spawn and does it turn up in other places?! "
6516,Sad you can't register but I understand why. Thank you!
6586,"Oh I'm good for stamina, thanks for letting me know! And yep that's the area. Near something bluff with all the weird pillars coming out of the ground. 

I'll keep my eyes open for the light again! :)"
20485,Do you know where to get the quest? I got a photo! 
