Timestamp,Message
6956,"yeah you can, unfortunately you can't board it at the stable though. It has infinite stamina though which is nice"
7131,Does your horse die if you leave it out too long? I left one of my horses near the entrance of Gerudo Desert for a long time without checking it back into a stable and I guess it died
7195,http://i.imgur.com/0s2oODO.gif
7237,it just means they are brand new and haven't been used/damaged yet
19574,"yeah when I went back to the stable, it wasn't available anymore. I had to resurrect it"
19977,I just mash the fuck out of L with my dominant index finger
20035,"it's pretty funny, too"
20521,possibly haha. Someone else mentioned it may have been killed by the heat
