Timestamp,Message
9169,"is there a way to check how many total hours you've put into BoTW? Im on the WiiU version, and would love to see just how much time i've actually put into this game"
9251,i havent found that particular horse...but from what i've read is that it is really rare and cant be registered
9393,"if it is already registered then feel free to leave it anywhere. If you have just tamed it and havent registered it, then when you fast travel it'll be gone forever (also it might despawn if you go far enough away..idk)"
36442,Thanks!
36450,Thanks for helping
36492,I found it under the daily log app. I got the game on launch day (75.5 hours into it)
45451,"it's fine. I figured it out either way, so no hard feelings"
