Timestamp,Message
2406,"you need another piece of hardware to record it, the record screen feature is not implemented yet"
7267,"1- yes he does, it is a rare item, he only sells it when it is raining

2- Ancient Proficiency increment the attack of a ancient or guardian weapon  80% and if you use a mighty elixir/cook you will have 150% attack increment

edit: grammar, 1- fixed"
9723,"yeah, it only affects ancient/guardian weapons not the enemy that you are attacking, plus if you attack a guardian with a guardian weapon it is going to receive an attack increment of 50%"
12007,Wow i did not know about raining items. Is for every seller?
49775,"It is better, and the satisfaction when you kill those guys is priceless"
