Timestamp,Message
34128,"So in this game, aonuma said it makes sense to be right handed because the weapon attack buttons are on the right hand side of the controller"
34308,"Some of the items to can unlock from dlc are useful. Korok mask &amp; teleport thingy in particular.

Otherwise they don't do much before you get the Master Sword or do all the Divine Beasts"
34391,Urbosas memory from the Ballad of the Champions DLC
35160,"They always have been, yes."
52690,"The shield is in his left hand. Guess where the control for the shield is?

The jump button is also the top most face button."
59796,The trigger draws a bowstring with his right hand
