Timestamp,Message
31377,"Like the others said, you're probably good to start investing in stamina more. If you want to change your mind later there is a way to do so in Hateno Village."
31744,Just completed Tarrey Town; is 3 diamonds the only benefit? Lovely town and all but is that it?
32513,"I suppose. I'm sure I would have more use for the vendors if I had done the side quest earlier in the game. Though, arrows are always nice so I'll hit the Rito up for those."
36870,Yeah I forgot about that. I need to remember to do that more often.
49093,Same here. Its creepy as fuck haha. 
