Timestamp,Message
45041,I'd much rather the opposite.
45090,"It was in the ""brown color pallette"" era, which every game looked really bad."
45340,"The Wii's internals are notably outdated, hence why he says Nintendo has always made bad hardware decisions."
45418,"They won't do that. SS's art style was panned far too much, as was its controls."
45554,"You say ""gorgeous,"" I say ""colorful pixellated mess.""

It really didn't look that good in practice, especially stuck in 480p."
45601,Please learn [reddiquette](http://www.reddit.com/help/reddiquette) 
124901,To me it looked like Gears of War with a Zelda skin on it...wasn't impressed and still not really impressed.
