Timestamp,Message
52279,I am disappointed to find out so many Zelda fans are so ignorant and racist. Definitely not what the Hero of time would stand for. 
52376,I heard you were a racist piece of shit and all your 41 supporters lol
52493,"Dude, do you even know about other countries currency? not the whole world uses dollars? get your ass out of your entitled little shit world and shut the fuck up. "
52993,"Smart guy, that would have been 300 dollars in muurica and you would have gotten a shitty muurrican tattoo artist."
53389,And the fact still stands lol.. but seriously. You should educate yourself or do some research before making stupid ass out of context comments. 
