Timestamp,Message
50965,That is *not* a good tattoo. 
51672,"What do you like better, the non symmetry of it, the uneven Triforce, or the uneven stick figure legs?"
51909,"No it looks like shit. It’s uneven as fuck. The Triforce triangles aren’t even the same size, and the fucking stick figure legs. "
52179,It’s objectively bad. Why lie about it?
53824,"Just look at the uneven shape under the triforce, and the stick figure legs. He got exactly what he payed for. Saying it’s a bad tattoo doesn’t make anyone an asshole. "
