Timestamp,Message
28526,"I believe that is the case, but it should still despawn over time, right? Or else I would just drop all my items in my house as storage. "
28648,"I thought they fixed that exploit in the latest patch. At least I read they did, haven't confirmed it for myself."
28801,"Easiest way to shield surf is to 

1) Jump first

2) Press ZL and A at the same time.

Or whatever your shield button is, I play on wii u. Not sure why other people shield before jumping. I mean whatever works, but this is the way I do it and it just seems easier. "
