Timestamp,Message
10760,I would have to disagree on OOT being non-replayable. I find myself being able to replay it constantly no matter how many times I've already beaten it. It's my favorite game ever by far.
10806,"&gt; Link between worlds is better than Link to the past.

Yes!"
52370,"Well, the graphics are nicer. I think it's easier to understand (first time I played ALTTP I got lost SOOO many times), super awesome to get new items, really great story, super fun dungeons, great ability.... Just get it :D!"
52385,Ages &gt; Seasons
121599,"Not at all, unless you want all items/heart pieces."
