Timestamp,Message
26191,"The arbitrary treasure hunt in TP. I don't want to become a wolf and search for the magical glowy dingleberries!

I JUST WANT TO BOMB SOME DODONGOS! X3"
36745,"I liked the mechanic, it was good fun escaping the dungeon. But the rest sucked. Probably my least favourite LoZ in all honesty - still a good game, just wish I could skip the shitty wolf parts. "
65720,"Yeah. Dingleberry.

It's an apt metaphor. Could be the world most perfect ass - but if you have to endure a dingler, replayability *at the very least* is **right** out of the window."
