Timestamp,Message
14286,"It's not that bad. Put one of them in a corner so you're only moving one at a time. Get them lined up and then make the final move.

It's just planning a few steps ahead."
14394,"I always did the swamp first, so that I'd have the cane to bypass the block pushing puzzle.

Did it that way first time through by accident and didn't realize it until replay.

Misery Mire is no cakewalk without the blue mail, but it's quite doable with potions and fairies."
14486,"LttP may have been 2D, but it had plenty of 3D puzzles involving rooms above each other."
14532,Stuck in MQ? Dins fire. Dins fire everything.
