timestamp,source_ip,destination_ip,domain,resource,message
1682911302,102.0.0.45,101.0.0.10,evil.dne,/resource7.html,I'm curious as to why?
1682911302,102.0.0.45,101.0.0.10,evil.dne,/resource7.html,What? Why?...
1682911302,102.0.0.45,101.0.0.10,evil.dne,/resource7.html,Everyone seems so bitter in this thread... what's happening?
1682911302,102.0.0.45,101.0.0.10,evil.dne,/resource7.html,"I saw that... Which prompted me to make this comment, among others. 

Why is everyone in such a sour mood? :/"
1682911302,102.0.0.45,101.0.0.10,evil.dne,/resource7.html,"The whole new costume dynamic is being introduced!

The game might be multiplayer centric, but that doesn't mean it still won't have a kick ass single-player experience! This is definitely not a half-assed game! This is a whole-new Zelda adventure. I wouldn't worry about it."
1682911303,102.0.0.45,101.0.0.10,evil.dne,/resource7.html,"Thanks man, this whole thread seems so lackluster. I'm very disappointed in everyone's reactions..."
1682911303,102.0.0.45,101.0.0.10,evil.dne,/resource7.html,"I was asking for it. In fact, I knew a lot people asking for another multi-player Zelda game! 

First of all, 3DS is the most wirelessly connective device Nintendo has ever made. They made two multi-zeldas that required cables for christ's sake, now that they've created this wireless juggernaut, why woulnd't they release a new Zelda game?!  You're totally wrong on all three of your points...  I don't usually play 3DS on the go, I play it in my home, on the couch or something while the TV's on. I know a lot of other people who do this too, including practically ALL of Japan.

 How do you know that you wont be able to communicate with other people? Have you played the game yet? The online aspects of this game are enormous! You might even meet new people online! Who knows?!?!

Also the levels probably won't be too long because of the online commitment, which might be a gripe, but it's only speculation at this point...

They said they were going to have a single-player experience worthwhile, and I trust them...

Don't sulk, be happy! We're getting another Zelda game that no one expected. We weren't even sure we were going to get anything at this year's E3 for Zelda, and we needed up getting a whole new game! It's a bonus! Be grateful!"
1682911304,102.0.0.45,101.0.0.10,evil.dne,/resource7.html,"Exactly! I've been asking for this forever!!! Ever since the DS got wireless connectivity 10 years ago have I wanted a new multiplayer zelda game! Plus, we weren't even expecting a new game, or any exciting new Zelda news and now we have a brand new adventure to play! I swear to god, everyone's being so ungrateful and whiny:/"
1682911304,102.0.0.45,101.0.0.10,evil.dne,/resource7.html,"It'll probably be treated like the FS games in that, they're main series spin-offs lol"
1682911304,102.0.0.45,101.0.0.10,evil.dne,/resource7.html,I almost cried!!!!
1682911304,102.0.0.45,101.0.0.10,evil.dne,/resource7.html,Online!!!!
1682911304,102.0.0.45,101.0.0.10,evil.dne,/resource7.html,"1. it is a new game

2. you have no idea what you;re talking about apparently because experimenting is what Nintendo (and Zelda for that matter) is all about

3. It's not a mini-game

4. Why can't people wrap their head around the fact that it's a new, bonus Zelda game!?"
1682911305,102.0.0.45,101.0.0.10,evil.dne,/resource7.html,What if I told you it was a different development teams?
1682911306,102.0.0.45,101.0.0.10,evil.dne,/resource7.html,"Wait, are you kidding? It's the same art style as ALBW...."
1682911306,102.0.0.45,101.0.0.10,evil.dne,/resource7.html,"You're right, Majora's Mask sucked /s"
1682911306,102.0.0.45,101.0.0.10,evil.dne,/resource7.html,Well I'm just going by past Zelda experiences...
1682911306,102.0.0.45,101.0.0.10,evil.dne,/resource7.html,"Except I know a lot of people who do... *You* might, but don't lump your sorry ass into the rest of us. I'm extremely excited by this announcement! Everyone is so ungrateful! We weren't expecting ANY new Zelda content this E3, instead we got a completely new Zelda adventure! People need to get their heads out their asses and realize that we're getting 2 new Zelda games in 2 years and stop being so pissy"
1682911307,102.0.0.45,101.0.0.10,evil.dne,/resource7.html,"But Triforce Heroes *is* an exciting new project! I don't know... Besides, this r/Zelda, we're here to talk about the new ZELDA announcements at E3, not the other stuff that may have dissapointed people."
1682911307,102.0.0.45,101.0.0.10,evil.dne,/resource7.html,"I don't think Triforce Heroes will be a party game. I wouldn't worry about that! I'm sorry about the other games, though:/ Not being a big Metroid or Animal Crossing fan (not that I dont like them, just that I haven't played them) I guess this whole conference was overshadowed by the new Zelda announcement for me"
1682911307,102.0.0.45,101.0.0.10,evil.dne,/resource7.html,"Yeah, you're being a bitter asshole, and *I'm* the one with no brain...

*Uncharted (already announced, got gameplay for it)

*Halo (already announced, got gameplay for it)

*Battlefront (already announced, got gameplay for it)

Out of the 5 games mentioned, 1 is a remake and 3 were alreaedy announced!!

Nintendo reveals a new Paper Mario/Mario and Luigi Cross Over, gives us a ton of gameplay for starfox, Xenoblade X trailer, a couple of other new games, what the fuck are you looking for?! Just cause you don't like the new games announced, doesn't mean they didn't announce new games. Youre a selfish, childish, shit-brain of a fan who lacks reference... It's embarrassing...

"
1682911307,102.0.0.45,101.0.0.10,evil.dne,/resource7.html,"I understand, i'm saying instead of being so negative about the new announcement (at least for Zelda) try to be positive! Let yourself believe that Nintendo will pull this off! They've never let us down with Zelda yet!"
1682911308,102.0.0.45,101.0.0.10,evil.dne,/resource7.html,"It seems that we both agree. I think people need to realize that this a bonus game we're getting while we wait for Zelda Wii U. We weren't expecting anything new but we got this and i think people should be a little more grateful for this announcement. And i really try to stray from using the term ""spin-off"" cause even spin-offs in Zelda are treated like main games."
1682911308,102.0.0.45,101.0.0.10,evil.dne,/resource7.html,"It's also easy to forget that Nintendo has an entirely different demographic piled on on top of us, and that they need to cater to that demo too!"
1682911310,102.0.0.45,101.0.0.10,evil.dne,/resource7.html,"Jesus Christ.... this comment hurt me. you're lack of understanding for what you're talking about physically hurts me. Okay, where should we start?!

3DS Mario RPG games. I know a lot of people who actually really enjoy them and look forward to getting the next one when they're announced! So, they're pretty happy about aht announcement.

Your love for Super Mario RPG 2 tells me you had a Super Nintendo growing up and that you're one of those nostalgic asshat gamers who hate Nintendo because they've changed since you were a kid in the 90's. 

Then, you go on to talk about Xenoblade X. Don't like a game? Insult it's audience! That's the intelligent and level headed thing to do!:D Something tells me  you probably still need more growing up there, sport!

What would you call Mario Maker then? Is it a mario game? Yes. Is it on console? Yes. So..... console mario game... cool.

Nintendo told us *eons* ago that they weren't gonna show any Wii U Zelda game footage because they delayed the game. The fact that you were not aware of this, doesn't mean they fucked up. That   means you were ill informed (a trend I'm beginning to really pick up here) Everyone knew except you apparently.

HAHAHAHA Steaming hot dump! THAT'S SO FUNNY. You sound like a 5th grader learning how to use dirty words in a sentence! Keep practicing, buddy:) As for the Metroid thing, i can see why some people would be disappointed, as it's a spin-off and not a true Metroid game. Looks pretty cool, but I can understand your disappointment.

""The graphics aren't good!!!!!!!!!"" is literally the stupidest excuse for disliking a game I've ever sen. WHO THE FUCK CARES THAT IT LOOKS LIKE GCN GRAPHICS?! Is it gonna be fun, you don't know yet. Does it look like it keeps in spirit with the star fox series? Yes. But you're such a shallow moron, all you care about is the graphics...

Sony was very lackluster in their conference, are you kidding?! They gave us Uncharted and................. uhhhhhhh Last Guardian? 3 years too late? A remake of a 10 year old game? No Man's Sky looked cool. Dreams was just a tiny teaser with no release date and we got 5 minutes of Uncharted gameplay. What E3 have you been watching?!

Microsoft did a lot better. The backwards compatibility was a great feature to add and mod support for Fallout 4 was cool too. But we didn't ""get **Motherfucking Fallout 4 and Doom**. Fallout 4 was announced two weeks ago. We got gameplay footage. WHICH IS WHAT NINTENDO GAVE US. Same with Doom.

Safe to say, you have no clue what you're talking about, you have the mindset of a 3rd grader and there really isn't any talking to you because your skull is too thick for any information to pass through it to your incredibly tiny brain."
1682911310,102.0.0.45,101.0.0.10,evil.dne,/resource7.html,"We weren't expecting ANYTHING new for Zelda. We get something new and everyone throws a hissy fit! I don't get it... we weren't even expecting this. This was a total surprise. It's not like they said ""Hey guys, new Zelda 3DS game this E3"" they just came out and gave it to us... That's pretty awesome. People need to stop complaining about a BONUS Zelda game..."
1682911310,102.0.0.45,101.0.0.10,evil.dne,/resource7.html,"Those are very good counters to all my points! I'm so glad you realized I'm right:) I'm not even defending Nintendo, I'm countering your incredibly shitty points! Out of all of those series the only one I even care about is Zelda, that's it. I couldn't care less about anything else, youre just so bad at not sounding like a whiny prick that I couldn't resist!"
1682911310,102.0.0.45,101.0.0.10,evil.dne,/resource7.html,"What? They can't create spin-offs using popular IPs? And you say ""approaching"" so we're not there yet. You *really* think Nintendo isn't working on something for the 30th. Have a little more faith than that!"
1682911311,102.0.0.45,101.0.0.10,evil.dne,/resource7.html,"(well that is one of their demographics:/)

And what makes you think next years E3 wont have new metroid for the holiday season?"
1682911316,102.0.0.45,101.0.0.10,evil.dne,/resource7.html,Seriously! These people are ridiculous!  They get a brand new Zelda game and all they do is whine and bitch...
1682911316,102.0.0.45,101.0.0.10,evil.dne,/resource7.html,I'm with you on that...
1682911316,102.0.0.45,101.0.0.10,evil.dne,/resource7.html,Go back and watch A Link Between Worlds' reveal trailer. Then think about how awesome that game was...
1682911317,102.0.0.45,101.0.0.10,evil.dne,/resource7.html,"Okay

1. How do you know it doesn't have a full story? Watch ALBW reveal trailer and tell me if you thought it had any story then

2. Zelda is ALL ABOUT GIMICKS! Have you ever even played a Zelda game?

3. 
&gt; serious zelda entry

   are you for real?
"
1682911317,102.0.0.45,101.0.0.10,evil.dne,/resource7.html,"Yeah, instead of creating all new Zelda content, let's just take an old game and port it to 3DS, are you even reading what you type?!?!"
1682911319,102.0.0.45,101.0.0.10,evil.dne,/resource7.html,"May have overreacted. But my pet peeve with Zelda fans is the want for remakes. You should ALWAYS want new original content. You have to be crazy not to, even if it's multiplayer you don't know how it'll play single player!"
1682911319,102.0.0.45,101.0.0.10,evil.dne,/resource7.html,"You can't be underwhelmed by a surprise present, that's just rude."
1682911320,102.0.0.45,101.0.0.10,evil.dne,/resource7.html,"But absolutely none of the ""innovated"" aspects of OOT and MM appeared in ALBW. I'm all for porting games too, like, the  Wii U virtual console and stuff, but all out devoting a development team to remake an old game is ridiculous!"
1682911320,102.0.0.45,101.0.0.10,evil.dne,/resource7.html,"But it's a toon link game on a 3DS. Of course it'll be whimsical and silly, that's what Zelda does best! Even the mist serious Zelda games have silly and whimsical elements...

The clothing system in general is a very cool concept! Think about. Spending time unlocking an outfit with a certain perk to it, then replaying levels with that perk. It makes for a different experience every time you play, I think that's really cool!"
1682911320,102.0.0.45,101.0.0.10,evil.dne,/resource7.html,"The clothing system in general is a very cool concept! Think about. Spending time unlocking an outfit with a certain perk to it, then replaying levels with that perk. It makes for a different experience every time you play, I think that's really cool! Zelda is all about gimmicks and experimentation! I think this could be a really great idea!"
1682911321,102.0.0.45,101.0.0.20,mparticle.com,/,
1682911322,102.0.0.45,101.0.0.10,evil.dne,/resource7.html,"Why are you disappointed it looks like four swords? And I wouldn't say it's a remake of FS because it has all new mechanics, levels, characters, gameplay, dungeons and links. Also, there's no four sword, so I mean, not counting ALL those things, I guess you... couldn't even come close to calling it a remake...."
1682911323,102.0.0.45,101.0.0.10,evil.dne,/resource7.html,"1. [This one](https://www.youtube.com/watch?v=IcZ8wnPWb4s)

2. You're right, touch screen controls were totally necessary for Phantom Hourglass's story! Fashion consciousness plays in line with the new mechanic, so you backed yourself into a corner there. It will be canon. Just like four swords and FSA.

3. There is no such thing as serious Zelda. Anyone who thinks so is delusional."
1682911323,102.0.0.45,101.0.0.10,evil.dne,/resource7.html,"THATS EVERY SINGLE ZELDA GAME EVER!!!!! One or two new mechanics. Different graphics and a tweaked story!!! Have you ever played a Zelda game before?!

Hopefully"
1682911323,102.0.0.45,101.0.0.10,evil.dne,/resource7.html,"Okay, fair enough. I'm sorry you're disappointed:/"
1682911324,102.0.0.45,101.0.0.10,evil.dne,/resource7.html,"I'm just saying the reasons for disliking it are unfounded: / And it makes me very disappointed as a fan to see so many people whine and complain about a game that we don't deserve, but got.

Name some similarities between FS and TW, please"
1682911326,102.0.0.45,101.0.0.10,evil.dne,/resource7.html,"Yes, because hands in the toilet, leading chickens around with a flute and dancing with the rosa sisters were all super serious and gritty...."
1682911327,102.0.0.45,101.0.0.10,evil.dne,/resource7.html,So would you call Wind Waker a serious Zelda game because it's apocalyptic flood and millions of deaths? 
1682911342,102.0.0.45,101.0.0.10,evil.dne,/resource7.html,It will be and that's fine with me:)
1682911350,102.0.0.45,101.0.0.20,gvt2.com,/,
1682911374,102.0.0.45,101.0.0.20,edgesuite.net,/,
1682911400,102.0.0.45,101.0.0.20,bytefcdn-oversea.com,/,
1682911400,102.0.0.45,101.0.0.10,evil.dne,/resource7.html,I'm curious as to why?
1682911401,102.0.0.45,101.0.0.10,evil.dne,/resource7.html,What? Why?...
1682911401,102.0.0.45,101.0.0.10,evil.dne,/resource7.html,Everyone seems so bitter in this thread... what's happening?
1682911401,102.0.0.45,101.0.0.10,evil.dne,/resource7.html,"I saw that... Which prompted me to make this comment, among others. 

Why is everyone in such a sour mood? :/"
1682911401,102.0.0.45,101.0.0.10,evil.dne,/resource7.html,"The whole new costume dynamic is being introduced!

The game might be multiplayer centric, but that doesn't mean it still won't have a kick ass single-player experience! This is definitely not a half-assed game! This is a whole-new Zelda adventure. I wouldn't worry about it."
1682911401,102.0.0.45,101.0.0.10,evil.dne,/resource7.html,"Thanks man, this whole thread seems so lackluster. I'm very disappointed in everyone's reactions..."
1682911402,102.0.0.45,101.0.0.10,evil.dne,/resource7.html,"I was asking for it. In fact, I knew a lot people asking for another multi-player Zelda game! 

First of all, 3DS is the most wirelessly connective device Nintendo has ever made. They made two multi-zeldas that required cables for christ's sake, now that they've created this wireless juggernaut, why woulnd't they release a new Zelda game?!  You're totally wrong on all three of your points...  I don't usually play 3DS on the go, I play it in my home, on the couch or something while the TV's on. I know a lot of other people who do this too, including practically ALL of Japan.

 How do you know that you wont be able to communicate with other people? Have you played the game yet? The online aspects of this game are enormous! You might even meet new people online! Who knows?!?!

Also the levels probably won't be too long because of the online commitment, which might be a gripe, but it's only speculation at this point...

They said they were going to have a single-player experience worthwhile, and I trust them...

Don't sulk, be happy! We're getting another Zelda game that no one expected. We weren't even sure we were going to get anything at this year's E3 for Zelda, and we needed up getting a whole new game! It's a bonus! Be grateful!"
1682911402,102.0.0.45,101.0.0.10,evil.dne,/resource7.html,"Exactly! I've been asking for this forever!!! Ever since the DS got wireless connectivity 10 years ago have I wanted a new multiplayer zelda game! Plus, we weren't even expecting a new game, or any exciting new Zelda news and now we have a brand new adventure to play! I swear to god, everyone's being so ungrateful and whiny:/"
1682911402,102.0.0.45,101.0.0.10,evil.dne,/resource7.html,"It'll probably be treated like the FS games in that, they're main series spin-offs lol"
1682911402,102.0.0.45,101.0.0.10,evil.dne,/resource7.html,I almost cried!!!!
1682911402,102.0.0.45,101.0.0.10,evil.dne,/resource7.html,Online!!!!
1682911402,102.0.0.45,101.0.0.10,evil.dne,/resource7.html,"1. it is a new game

2. you have no idea what you;re talking about apparently because experimenting is what Nintendo (and Zelda for that matter) is all about

3. It's not a mini-game

4. Why can't people wrap their head around the fact that it's a new, bonus Zelda game!?"
1682911403,102.0.0.45,101.0.0.10,evil.dne,/resource7.html,What if I told you it was a different development teams?
1682911404,102.0.0.45,101.0.0.10,evil.dne,/resource7.html,"Wait, are you kidding? It's the same art style as ALBW...."
1682911404,102.0.0.45,101.0.0.10,evil.dne,/resource7.html,"You're right, Majora's Mask sucked /s"
1682911405,102.0.0.45,101.0.0.10,evil.dne,/resource7.html,Well I'm just going by past Zelda experiences...
1682911405,102.0.0.45,101.0.0.10,evil.dne,/resource7.html,"Except I know a lot of people who do... *You* might, but don't lump your sorry ass into the rest of us. I'm extremely excited by this announcement! Everyone is so ungrateful! We weren't expecting ANY new Zelda content this E3, instead we got a completely new Zelda adventure! People need to get their heads out their asses and realize that we're getting 2 new Zelda games in 2 years and stop being so pissy"
1682911405,102.0.0.45,101.0.0.10,evil.dne,/resource7.html,"But Triforce Heroes *is* an exciting new project! I don't know... Besides, this r/Zelda, we're here to talk about the new ZELDA announcements at E3, not the other stuff that may have dissapointed people."
1682911405,102.0.0.45,101.0.0.10,evil.dne,/resource7.html,"I don't think Triforce Heroes will be a party game. I wouldn't worry about that! I'm sorry about the other games, though:/ Not being a big Metroid or Animal Crossing fan (not that I dont like them, just that I haven't played them) I guess this whole conference was overshadowed by the new Zelda announcement for me"
1682911406,102.0.0.45,101.0.0.10,evil.dne,/resource7.html,"Yeah, you're being a bitter asshole, and *I'm* the one with no brain...

*Uncharted (already announced, got gameplay for it)

*Halo (already announced, got gameplay for it)

*Battlefront (already announced, got gameplay for it)

Out of the 5 games mentioned, 1 is a remake and 3 were alreaedy announced!!

Nintendo reveals a new Paper Mario/Mario and Luigi Cross Over, gives us a ton of gameplay for starfox, Xenoblade X trailer, a couple of other new games, what the fuck are you looking for?! Just cause you don't like the new games announced, doesn't mean they didn't announce new games. Youre a selfish, childish, shit-brain of a fan who lacks reference... It's embarrassing...

"
1682911406,102.0.0.45,101.0.0.10,evil.dne,/resource7.html,"I understand, i'm saying instead of being so negative about the new announcement (at least for Zelda) try to be positive! Let yourself believe that Nintendo will pull this off! They've never let us down with Zelda yet!"
1682911407,102.0.0.45,101.0.0.10,evil.dne,/resource7.html,"It seems that we both agree. I think people need to realize that this a bonus game we're getting while we wait for Zelda Wii U. We weren't expecting anything new but we got this and i think people should be a little more grateful for this announcement. And i really try to stray from using the term ""spin-off"" cause even spin-offs in Zelda are treated like main games."
1682911407,102.0.0.45,101.0.0.10,evil.dne,/resource7.html,"It's also easy to forget that Nintendo has an entirely different demographic piled on on top of us, and that they need to cater to that demo too!"
1682911408,102.0.0.45,101.0.0.10,evil.dne,/resource7.html,"Jesus Christ.... this comment hurt me. you're lack of understanding for what you're talking about physically hurts me. Okay, where should we start?!

3DS Mario RPG games. I know a lot of people who actually really enjoy them and look forward to getting the next one when they're announced! So, they're pretty happy about aht announcement.

Your love for Super Mario RPG 2 tells me you had a Super Nintendo growing up and that you're one of those nostalgic asshat gamers who hate Nintendo because they've changed since you were a kid in the 90's. 

Then, you go on to talk about Xenoblade X. Don't like a game? Insult it's audience! That's the intelligent and level headed thing to do!:D Something tells me  you probably still need more growing up there, sport!

What would you call Mario Maker then? Is it a mario game? Yes. Is it on console? Yes. So..... console mario game... cool.

Nintendo told us *eons* ago that they weren't gonna show any Wii U Zelda game footage because they delayed the game. The fact that you were not aware of this, doesn't mean they fucked up. That   means you were ill informed (a trend I'm beginning to really pick up here) Everyone knew except you apparently.

HAHAHAHA Steaming hot dump! THAT'S SO FUNNY. You sound like a 5th grader learning how to use dirty words in a sentence! Keep practicing, buddy:) As for the Metroid thing, i can see why some people would be disappointed, as it's a spin-off and not a true Metroid game. Looks pretty cool, but I can understand your disappointment.

""The graphics aren't good!!!!!!!!!"" is literally the stupidest excuse for disliking a game I've ever sen. WHO THE FUCK CARES THAT IT LOOKS LIKE GCN GRAPHICS?! Is it gonna be fun, you don't know yet. Does it look like it keeps in spirit with the star fox series? Yes. But you're such a shallow moron, all you care about is the graphics...

Sony was very lackluster in their conference, are you kidding?! They gave us Uncharted and................. uhhhhhhh Last Guardian? 3 years too late? A remake of a 10 year old game? No Man's Sky looked cool. Dreams was just a tiny teaser with no release date and we got 5 minutes of Uncharted gameplay. What E3 have you been watching?!

Microsoft did a lot better. The backwards compatibility was a great feature to add and mod support for Fallout 4 was cool too. But we didn't ""get **Motherfucking Fallout 4 and Doom**. Fallout 4 was announced two weeks ago. We got gameplay footage. WHICH IS WHAT NINTENDO GAVE US. Same with Doom.

Safe to say, you have no clue what you're talking about, you have the mindset of a 3rd grader and there really isn't any talking to you because your skull is too thick for any information to pass through it to your incredibly tiny brain."
1682911409,102.0.0.45,101.0.0.10,evil.dne,/resource7.html,"We weren't expecting ANYTHING new for Zelda. We get something new and everyone throws a hissy fit! I don't get it... we weren't even expecting this. This was a total surprise. It's not like they said ""Hey guys, new Zelda 3DS game this E3"" they just came out and gave it to us... That's pretty awesome. People need to stop complaining about a BONUS Zelda game..."
1682911409,102.0.0.45,101.0.0.10,evil.dne,/resource7.html,"Those are very good counters to all my points! I'm so glad you realized I'm right:) I'm not even defending Nintendo, I'm countering your incredibly shitty points! Out of all of those series the only one I even care about is Zelda, that's it. I couldn't care less about anything else, youre just so bad at not sounding like a whiny prick that I couldn't resist!"
1682911409,102.0.0.45,101.0.0.10,evil.dne,/resource7.html,"What? They can't create spin-offs using popular IPs? And you say ""approaching"" so we're not there yet. You *really* think Nintendo isn't working on something for the 30th. Have a little more faith than that!"
1682911409,102.0.0.45,101.0.0.10,evil.dne,/resource7.html,"(well that is one of their demographics:/)

And what makes you think next years E3 wont have new metroid for the holiday season?"
