Timestamp,Message
13786,"you can also start a fire, light an arrow on fire, and point the arrow at the ice"
13922,There is a place nearby that will give you something that helps with lightning 
13949,only way I can think of is to take a screenshot in Miiverse
29987,I found the Diamond headband to be incredibly useful 
30168,they held hands once
31520,"yes it is. It has the same defense as the ancient helm. I liked wearing it cause it looked better lol but if you want the ancient proficiency bonus, you're better off with the helm"
