Timestamp,Message
41002,"Same ^

Red Zora armor for life in remembrance of would-be fish wife."
41303,"Marin &lt;3, from Link's Awakening still makes me cry.


I need to remember to see if her DLC is available on the WiiU version of Hyrule Warriors, or if that was just 3ds.."
47054,"Symbolic of Link's life, he is now dyed in her color."
57567,"..well she did mention wanting to spend more time together, like they used to after things calmed down... and she went out of her way for (? a decent) amount of time to make Link the armor.. and she somehow happened to have his sizing done perfectly...

I think Link knew. ;)  ..and that's what I'm gonna go with. "
