Timestamp,Message
2500,Eight feet tall desert amazons. I'm okay with that.
109389,Who?
109933,"Out of curiosity, is there any way to hear all the different soundbytes Kass has for the ancient song quests? I noticed they were all subtly different lines (pretty much the accordion version of the BotW theme) and the only reason I haven't completed them yet is because I'm saving them for last - I love listening to those ancient songs and you don't get to hear them after you complete the riddles."
133101,"Ooooooh. I love you for this, it's exactly what I'm looking for.

Does Kass ever play these song bits again in-game?"
136822,"Wait. He disappears from stables too?

Ffff. I think that may have killed any desire for me to 100% the game."
