Timestamp,Message
26779,How many shrines have you done? I thought I had some a lot at around 40 but you've got so much stamina.
26874,Guardian Amiibo gives you an arrow that one shots these guys.
26967,How do you get fairys? I've found some at the great fairy fountain but they fly away from me.
27118,I want this. You got any tips for farming?
33021,I only kill them with ancient arrows. I don't try otherwise
33054,I love how it's basically an rpg without xp or levels but somehow it works.
34396,I'm scared to go into hyrule castle without being prepared. I snuck in to get my memory of zelda and I was almost got my ass handed to me fighting 1 guardian.
85580,I suck at timing my shield bash
