Timestamp,Message
46688,"A follower/friend would be great... As long as they don't do handholding. An option to turn off their hints would be nice too.

Also, what's wrong with Midna?!"
46814,That I won't have a Wii U and I won't have enough money to buy one because I'm not of age to get a decent job.
46871,"BUT NINTENDO WILL REVOLUTIONISE THE GAMING EXPERIENCE TO MAKE IT MORE INTERACTIVE AND IMMERSIVE

*One day...*"
47055,"IMO cutscenes should be skippable after you have viewed them once, the way Conker's Bad Fur Day did it."
