Timestamp,Message
15847,"with attack boost yes.
i like to prolong it just a bit to get a few more gems
"
15961,he probably worked really hard for his game time. possibly took vacation time. stayed up late with work the next day. and i assume still supported his family. id call that at a premium
21078,"what youre saying doesn't make  what i said necessarily untrue.
im fairly certain a guide was used. thats still work to get 900 seeds with a guide. so im not sure why the disagreement "
22853,gotcha. that makes more sense haha more likely did make it sound contrary to what i was saying lol
