Timestamp,Message
3111,"Same here. 9 month old. It took me roughly 2 months to get all shrines, all koroks, 100% compendium"
6956,"Well, unfortunately, each map discovery is .08% completion. Doesn't matter how grand the discovery. 

There are approximately (120?) named locations which count toward completion as well. Towers, bridges, towns, cottages (some abandoned) and a few natural locations count. 

I spent a good amount of time ticking off the last couple named locations I missed... It was just as annoying as koroks. 

Though there were some *really* annoying koroks. "
32485,"I have 210 hours but there was a lot of idle time there as well, tending to a baby and all! "
