Timestamp,Message
82478,"They were built 10,000 years ago.  Maybe there were drawings of, or legends about Elephants and Camels back then?"
82954,"&gt; LITERALLY GO ANYWHERE YOU CAN SEE.

Fine; you can literally go anywhere in Hyrule that you can see.

Except into the sky.  Or the bottom of the ocean.  Since we're being pedantic about a point that is implicit in every discussion anyway."
83230,"The Demise fight was truly excellent, a shame they didn't really present much in the way of a sword duel in this.

I could definitely have gone a through a phase or two of tennis with Ganon as well.  I lost a bit of health assuming that was one of the ways to beat back some of his attacks."
