Timestamp,Message
7166,His name is really Link Link?
11362,"Also Aonuma doesn't really care about connections between games so he constantly pulls new weird stories out of his ass. 

They probably let their interns work for 5 weeks straight on a desperate solution to somehow connect the games."
12856,"I feel like a lot of times they have no idea how to answer a question and just pull something out of their ass. Like when someone asked Aonuma who the Fierce Deity is and he goes ""Uhh, he's like everyone's memories."""
18462,"I don't think it is, in the game it's just referred to as evil or ""bad guy"" and the manga doesn't really matter."
