Timestamp,Message
11856,"the name was added on the Link to the Past's NA release

that game also names Ganon ""Mandrag Ganon"""
12184,"This was only on the NA translation of A Link to the Past

on that case, that same Ganondorf/Ganon is the same from OoT"
21208,"actually, he creates the Dark World indirectly. The Dark World was originally the Sacred Realm but the sages tricked Ganon into enter it to claim the Triforce and sealed him there"
23201,"nope

before now, only ALttP mentions his last name"
82353,"Mandrag means ""of the enchanted thieves"""
