Timestamp,Message
16973,"Trust me, you aren't. Every time Majora's Mask comes up, someone says the exact same thing..."
17362,"Honestly, despite all the seeming negativity from so many others, I'm really happy. Wind Waker is definitely my favorite Zelda game, and my favorite game overall.

As for the others, I haven't played many of them (although most of them I would like to), so I can't really say how I feel about that, besides liking Portal 2 more than Portal 1. And like others have said: Wii Sports? Really? "
17998,That was not clear at all in your original comment. 
53898,He added that in after I had already commented.
