Timestamp,Message
14795,"""Of the Decade."" Majora's Mask came out 12 years ago."
14861,"This is a really good list. Just about every game on there is brilliant, only one I'd shake my head at is 'Wii Sports.' I'd replace it with Metroid Prime. IMO, Bioshock, Metroid Prime and Wind Waker are the three 'perfect with negligible margin of error' video games."
15022,"Arkham City was 2011. The list is 2002 to 2012, not 2000 to 2010."
21601,"Wow, you're really mad, aren't you bro?"
62250,"Metroid Prime was 2002, it came out about a month before Wind Waker so I think it could squeak through! Ah well."
