Timestamp,Message
13046,"Except he says ""I made another drawing for you guys,"" not ""I traced another drawing for you guys.""

EDIT: For everyone downvoting, I'm not saying there's no work involved in a quality tracing job. But there's no reason to be disingenuous about it. If I pull out my guitar and say, ""I made this song for you,"" you assume that it's an original piece of work, not a an exact cover of someone else's song."
22491,"You are agreeing with me and have 0 downvotes. I have 37 downvotes. I don't understand reddit sometimes.

EDIT: And now I've made the fatal mistake of pointing out downvotes! Away we go!!"
32724,"That's impossible. The problem is never with me, it's always with someone else."
