Timestamp,Message
131527,"It did for me.  Also fixed my problem of accidentally zooming into the sheika slate during combat.

I also later realized that my aim with the bow is better with the motion controls disabled."
131673,"&gt;Should I stop bitching and just play the game in Normal mode?

I'd give normal mode a spin first.  You'll still be bitching (for a little while) there at first, too.  You almost certainly want to learn combat there rather than in hard mode."
131926,What armor piece breaks the game?
137869,Hmmmm...that's a good point.  I grabbed all the armor right away but have just been wearing the korok mask so far.
