Timestamp,Message
52838,"1) It gets better as you get more equipment slots (more weapons to break) and as you get better weapons, as they break as quickly.

2) Save screenshots to SD card, put SD card into computer."
52874,"All the gems are used to buy some accessories from a town, and also to upgrade those accessories and certain equipment."
52926,"Idk about a direct answer, but I do know after you complete Tarley Town there's a merchant who sells the full set (4k a piece)."
52998,"If that's not it, cooking fruit with a single gem or wood bundle will give it a ""rock hard"" prefix."
