Timestamp,Message
16623,"I'm sure this is a common question but... is it worth holding out for the Switch? I suspect I will get one in the future, but money is tight and I don't fancy splashing out for just one game.

Fwiw, image quality (720p vs900) is something I don't care about at all, I am just worried about reports of FPS drop on the Wii U. How bad is the frame rate drop (or other version specific problems)?"
17778,"Ah awesome, thanks for the quick reply! "
17860,"I think I will do this, I thought I could be patient but I can't. Ty!"
17879,"Great, thanks for the fast reply!"
