Timestamp,Message
14648,"So for the Song of Storms shrine quest in Faron I solved it by just standing on the shrine and letting lightning strike me and then getting revived by the Vah Ruta healing power. 10/10 best game ever.

Also finished basically all of the Gerudo Desert last night except not really because I'm sure I missed a bunch of stuff because there is so much in this game and OMG I love it!"
16342,Wait until you storm the castle. Just wait.
17360,"Christ, I'm struggling to get past 45 shrines right now."
25857,I still haven't gone into Eldin or the Rito area so I have plenty of space to look. But backtracking for shrines has proven to be a challenge 
