Timestamp,Message
83170,"Used to visit ZU many years ago, can confirm. It's not a surprise to see this is still happening; those running the show always tended to be insular to their clique."
394306,"Jesus, small world"
394667,"Same! It doesn't feel like all that long ago but man, that was when MSN was still a thing, yikes"
394959,"Whoa, I forget whether you guys were married or not when I last saw you (I think so), but congrats on the kid!

Time flew for me too except basically nothing changed, ha ha"
