Timestamp,Message
31450,"But the flood happened specifically because there was no hero at all, so Ganon could never have killed him if he was never there."
31644,"What if Calamity Ganon is just a smokescreen from Ganon's mind. 

Lure the hero out into the open, force him to draw the Master Sword and release Ganondorf's physical body."
35926,"Oh yeah, no, I know Link wasn't gone until *after* Ganon broke out of the Sacred Realm.

It seems like Nintendo is throwing the biggest curveball because so many things point to BotW taking place in all three timelines."
