Timestamp,Message
21851,All of the Rune upgrades are at the Hateno Ancient Laboratory.
27414,"I may be misunderstanding, but it sounds like all three of those locations are very near to each other?"
34194,"On the Switch, you can go to your user profile page and it will show your time played on the right hand side. This takes some time after your first play to show up - mine didn't display time played until 10 days after I purchased the game."
34297,Is it gamebreaking bad? Your game is broken? 
34365,"When you do, would you mind replying to one of my posts, or tagging me, so I can take a look?"
58642,"When you go to your map, is ""leave this area"" available?"
