Timestamp,Message
58647,"Word on the street is that the new Zelda in production is going to have a single temple that is the size of OOT's Hyrule Field. It's supposed to be the biggest Zelda ever, by far. Hopefully it will be challenging as well. I hope Nintendo delivers!"
58757,"The weird thing about the well is that it's actually really, really easy if you know where to go. The first few play throughs are BRUTAL though. I hated falling in the basement with all of those re-deads and shit"
58975,"Yeah, the puzzles and layout of Link to the Past weren't terribly hard, but the enemies could be brutal. I died every five minutes in that game"
59323,"Shut up, Meg"
59534,I always thought that growing up. Just came here to brag.
