Timestamp,Message
78089,"Same. I'd only played the original and LttP prior to OoT, and Death Mountain was always where the game got hard. Not to mention the name!"
78436,"It's likely you'll run into him without looking for him, if you make a point of talking to people.

(Definitely talk to people. It'll make the game more interesting, gives you more background, and sometimes means a good sidequest.)"
78661,"You can't *always* drop a lantern. Some of them don't have lanterns/exploding barrels.

I also like chucking bombs in the eye holes. I stand on the ""mouth"" of the skull and throw them in. Cracks me up that the monsters never figure out what's going on."
