Timestamp,Message
85996,"I liked it. It was interesting. Could do without it, of course, or maybe an option, but isn't Smash Bros. *supposed* to be a random free-for-all (and you can team up too)?"
100310,"&gt;Don't you think evolving, interactive arenas and random item drops are enough randomness?

No. :|

Also, tripping barely ever gets me killed. Mostly it's because I'm bad at playing..."
102301,"Stubborn for having an opinion? Also, I never said it added anything to the game. I'm just trying to argue that it doesn't detract from the game."
159736,Just because the randomness of tripping may screw up your match doesn't mean it necessarily detracts from the game. &gt;:\
