Timestamp,Message
22514,"Medli is referenced in this game... Also Linebeck, and the leviathans appear to be Levias from SS, the windfish from LA, and Osshus from PH. "
22884,"I must disagree. There are a ton of references to every timeline, including, the Rito guardian being the namesake of Medli, Linebecks island, a ton of areas named after ST locations. 


Also, TP link DID use eponas song too. "
106086,why would they name an island after someone who never existed?
109223,"Nintendo went to great lengths to build the world and tie it all together. I'd say there is nothing that's ""just an easter egg"""
192093,how do you know they didn't happen in the timeline? 
