Timestamp,Message
964,"I noticed some slightly better textures, but yeah, kind of underwhelming.  I'm sure it'll look better on an actual HD screen, though."
1090,"oh great more amiibo

wonderful

im so happy"
72056,"Oh for sure, I totally get that they're great money makers for Nintendo, I just really and aggressively don't care about them and get slightly annoyed when Nintendo news can't go five minutes without mentioning them. As far as I know no games have actually gated gameplay content behind them yet, but that's only a matter of time, too."
