Timestamp,Message
16117,For some reason it really bothers me that you can fill your own sails with wind that you create and not have a net 0 velocity. 
53983,"Oops, never played WW"
100065,"It's not if you assume the leaf can't magically generate wind.. Imagine being closely tied to someone on an ice rink. If you push them, you don't both move in the direction of the push. You would move the opposite direction and cancel out the push.  Link will sooner pull his ship apart than to propel himself forward (barring magic leaf). "
114100,Link? 
137408,Holy physics hack! Haha I guess that is technically possible.. Okay I can play breath of the wild now 
